{"format_policy":{"base_format":"re_columnar_v1","compression":"gzip","exact_decimal_conversion":true,"parquet_optional_for_sample":true,"parquet_required_for_processed":true},"input_policy":{"allow_structurally_valid_fixture_sample":true,"reject_quarantined_days":true,"repair_or_interpolate_missing_events":false,"require_research_admission_for_processed":true,"require_structurally_valid_day":true,"require_verified_capture":true},"instruments":[{"price_increment":"0.01","quantity_increment":"0.00001","source":"step13_deterministic_fixture_contract","symbol":"BTCUSDT"},{"price_increment":"0.01","quantity_increment":"0.00001","source":"step13_deterministic_fixture_contract","symbol":"ETHUSDT"}],"output_tier":"sample","research_specification_changed":false,"schema_version":1,"symbols":["BTCUSDT","ETHUSDT"],"venue_id":"binance_spot"}
